DA,Name,Price,Discription,website
74,There's An AI For That (TAAFT),$347 ,The largest AI Tools Directory which collects more than 12000 AIs. It will collect the AI Product which is published in Product Hunt.,https://theresanaiforthat.com/
64,Toolify,$49 ,"Toolify AI directory has collected over 17,400+ AI tools. Products on Product Hunt may be automatically included for free.",https://www.toolify.ai/
14,Meo AI,free,"MeoAI | 17,000+ AI Tool Directory | Global AI Tool Collection | Free AI Tools | Focused on Artificial Intelligence",https://www.meoai.net/
0,Human or Not,Free,Explores and shares tools and technologies that collaborate between humans and AI.,https://www.humanornot.ai/
0,aitoolslist.io,Free,"A website dedicated to organizing and showcasing various AI tools, allowing users to increase the exposure of their tools by submitting them for free.",https://aitoolslist.io/
0,AIToolMall,Free,AIToolMall is a platform that offers various AI tools aimed at helping users solve different problems.,https://aitoolmall.com/
0,AILibri,Free,AILibri provides a range of AI tools focused on email assistance and 3D model creation.,https://ailibri.com/
0,ToolsFine,Free,"Provides refined categorization and display of AI tools, making it easy for users to choose.",https://toolsfine.com/
0,NextGenTools,Free,A directory platform showcasing next-generation AI technologies and tools.,https://www.nextgentools.eu/
0,Neil Patel AI Tools,Free,"Possibly operated by Neil Patel, offering marketing and business-related AI tools.",https://aitools.neilpatel.com/
0,tools-ai.online,Free,"A platform gathering various AI tools, providing comprehensive AI resources.",https://www.tools-ai.online/
0,ToolScout,Free,Provides users with detailed AI tool reviews and recommendations.,https://toolscout.com/
0,ToolHunter.ai,Free,A resource website that helps users discover and explore AI tools.,https://www.toolhunter.ai/
0,TopApps.Ai,Free,"Selects AI applications and tools, helping users quickly find suitable apps.",https://topapps.ai/
0,Nextool AI,Free,A showcase platform focusing on the latest AI tools and technologies.,https://www.nextool.ai/
0,SaaSBaba,Free,"An aggregation platform for SaaS-based AI tools, providing users with multiple options.",https://saasbaba.com/
0,Startup AI tools,Free,"An AI tools directory specifically designed for startups, supporting business growth.",https://stratup.ai/
0,Supertools,Free,"Focuses on a catalog of super AI tools, providing efficient and high-quality tool recommendations.",https://supertools.therundown.ai/
0,Insidr.ai,Free,"Focuses on AI tools for internal use or team collaboration, enhancing work efficiency.",https://www.insidr.ai/
0,AI Tools Masters,Free,Provides a collection of AI tools to help users explore and compare different AI solutions.,https://aitoolsmasters.com/
0,PoweredbyAI,Free,A directory showcasing innovative tools and applications powered by AI.,https://poweredbyai.app/
0,Full Stack AI,Free,"Focuses on full-stack AI solutions, providing abundant tool resources.",https://fullstackai.co/
0,fastpedia.io,Free,A directory platform aimed at quickly finding high-quality AI tools.,https://fastpedia.io/
0,AI Tools Up,Free,Provides a showcase platform for emerging or updated AI tools.,https://aitoolsup.com/
0,AI Worthy,Free,Collects and shares noteworthy AI tools and technologies.,https://aiworthy.org/
0,AIWikiTools,Free,"Provides users with a wiki-style directory of AI tools, containing detailed tool information.",https://aiwikitools.com/
0,AffordHunt,Free,"Focuses on cost-effective AI tools, selecting affordable options for users.",https://www.affordhunt.com/
0,AI-Hunter.io,Free,"Focuses on discovering and recommending AI tools, assisting users in seeking suitable AI solutions.",https://ai-hunter.io/
0,aitoolnavigation,Free,A directory website that helps users navigate and explore various AI tools.,https://www.theainavigator.com/
0,Aitoolnet,Free,"Provides a web directory of AI tools, helping users locate and evaluate different tools.",https://www.aitoolnet.com/
0,AI Library,Free,"As an online AI tools library, it provides users with a wide range of tools and technical resources.",https://www.theailibrary.co/
0,AITopTools,Free,"A platform showcasing top AI tools, allowing users to more easily find recommended resources.",https://aitoptools.com/
0,AIFINDY,Free,An online platform dedicated to helping users quickly find the AI tools they need.,https://aifindy.com/
0,AIToolsDirectory,Free,A detailed categorized AI tools directory that helps users discover new tools and applications.,https://aitoolsdirectory.com/
0,AI Valley,Free,"A platform that gathers AI tools, aiming to provide practical resources for AI developers and users.",https://aivalley.ai/